{
  "required" : true ,
  "$schema" : "http://json-schema.org/draft-03/schema" ,
  "type" : "object" ,
  "properties" : {
    "termType" : {
      "type" : "string" ,
      "required" : true
    } ,
    "invoiceTargetDate" : {
      "type" : "string" ,
      "required" : false
    } ,
    "contractEffectiveDate" : {
      "type" : "string" ,
      "required" : true
    } ,
    "previewAccountInfo" : {
      "type" : "object" ,
      "required" : false ,
      "properties" : {
        "currency" : {
          "type" : "string" ,
          "required" : false
        } ,
        "billToContact" : {
          "type" : "object" ,
          "required" : false ,
          "properties" : {
            "zipCode" : {
              "type" : "string" ,
              "required" : false
            } ,
            "country" : {
              "type" : "string" ,
              "required" : false
            } ,
            "city" : {
              "type" : "string" ,
              "required" : false
            } ,
            "county" : {
              "type" : "string" ,
              "required" : false
            } ,
            "state" : {
              "type" : "string" ,
              "required" : false
            }
          }
        } ,
        "billCycleDay" : {
          "type" : "number" ,
          "required" : false
        }
      }
    } ,
    "subscribeToRatePlans" : {
      "type" : "array" ,
      "required" : true ,
      "items" : 
        {
          "type" : "object" ,
          "properties" : {
            "chargeOverrides" : {
              "type" : "array" ,
              "required" : false ,
              "items" : 
                {
                  "type" : "object" ,
                  "properties" : {
                    "productRatePlanChargeId" : {
                      "type" : "string" ,
                      "required" : true
                    } ,
                    "quantity" : {
                      "type" : "number" ,
                      "required" : true
                    }
                  }
                }
              
            } ,
            "productRatePlanId" : {
              "type" : "string" ,
              "required" : true
            }
          }
        }
      
    } ,
    "initialTerm" : {
      "type" : "number" ,
      "required" : false
    }
  }
}